### ISSUE TITLE
VITA-49 stream never arrives over a routed VPN: radio streams from source port 4993, client primes only 4992

### ISSUE THREAD

**Issue by motoham88** [aethersdr/AetherSDR#4929]
Filed at @jensenpat's request on #4926, so the network-stack change there can be judged on evidence rather than on the PR description.

This is my own FLEX-6500 and my own WireGuard tunnel — every measurement below is one I ran, and I can re-run any of them on request. It is also, so far, the *only* radio this has been observed on, which I take to be the actual substance of the objection. The last section states plainly what is not established.

## Summary

Over a routed VPN, a FLEX radio connects normally over TCP — slices and pans are created, status flows — and **not one VITA-49 datagram ever arrives**. No spectrum, no waterfall, no audio. The same radio over SmartLink works every time, and the same radio on a flat LAN works every time.

Root cause, as measured: **the radio listens for the one-byte UDP prime on 4992, but streams VITA-49 back from source port 4993.** Those are two different flows. On a LAN nothing between client and radio keeps state, so priming 4992 alone is sufficient and the asymmetry is invisible. Over a routed VPN the far side is stateful: conntrack holds an entry only for the flow we primed (`client:L ↔ radio:4992`), so every pan, waterfall and audio datagram arrives as an unsolicited `radio:4993 → client:L` flow, matches nothing, and is dropped.

## Environment

| | |
|---|---|
| Radio | FLEX-6500 (mine), firmware **4.2.20.41343** |
| Client | AetherSDR, Linux (Fedora 44, kernel 7.1.6) |
| Transport | WireGuard, `wg0` MTU 1420, client `192.168.3.4/32` → radio `192.168.115.14` |
| RTT | ~37 ms |
| Protocol | v1.4.0.0 |

## Symptom

TCP `4992` connects, `V`/`H` arrive, `sub` succeeds, slices and pans are created and report status. `PanadapterStream` binds its UDP socket and sends the prime. Nothing ever arrives on that socket. The UI shows a connected radio with a dead panadapter and silent audio, with nothing to indicate why.

## Evidence 1 — application logs, controlled A/B on the affected radio

Three sessions I ran on the morning of 2026-08-11, same binary, same tunnel, same radio. Logs attached. IPs are masked by AetherSDR's own log redaction; `*.*.*. 14` is the radio, `*.*.*. 4` the client's tunnel address. The only edit I made to the attached logs is the radio's name field, replaced throughout with `KX3H-Flex6500`; nothing else is altered, and the serial was already masked to its last four by the logger.

**Priming both ports — stream arrives, from 4993:**

```
# aethersdr-20260811-073907.log
[07:39:13.406] INF aether.vita49: PanadapterStream: LAN VITA UDP bind addr=*.*.*. 4 port=56485 flags=DontShareAddress reason=probe-session
[07:39:13.407] DBG aether.vita49: PanadapterStream: sent UDP registration to "*.*.*. 14" ports 4992 and 4993
[07:39:13.634] INF aether.vita49: PanadapterStream: first UDP packet received after_ms=227 local_port=56485 from=*.*.*. 14:4993

# aethersdr-20260811-082628.log
[08:26:33.902] INF aether.vita49: PanadapterStream: LAN VITA UDP bind addr=*.*.*. 4 port=44054 flags=DontShareAddress reason=probe-session
[08:26:33.903] DBG aether.vita49: PanadapterStream: sent UDP registration to "*.*.*. 14" ports 4992 and 4993
[08:26:34.015] INF aether.vita49: PanadapterStream: first UDP packet received after_ms=111 local_port=44054 from=*.*.*. 14:4993
```

`from=*.*.*. 14:4993` is the whole finding, logged by the client on receipt: **the radio's VITA-49 source port is 4993**, not the 4992 we registered on. Twice, 111 ms and 227 ms after the prime.

**Prime to 4993 suppressed — nothing ever arrives:**

In the third session I blocked only the outbound prime to 4993 with an `iptables` rule, leaving the 4992 prime intact. That reproduces the pre-fix behaviour exactly, since priming 4992 alone is what the client used to do:

```
# aethersdr-20260811-082828.log — 37 of these, none of them followed by a packet
[08:28:33.549] WRN aether.vita49: PanadapterStream: UDP prime to "*.*.*. 14" : 4993 failed: "Unable to send a message"
[08:28:33.787] WRN aether.vita49: PanadapterStream: UDP prime to "*.*.*. 14" : 4993 failed: "Unable to send a message"
[08:28:34.036] WRN aether.vita49: PanadapterStream: UDP prime to "*.*.*. 14" : 4993 failed: "Unable to send a message"
...
[08:28:45.787] WRN aether.vita49: PanadapterStream: UDP prime to "*.*.*. 14" : 4993 failed: "Unable to send a message"
```

`grep -c "first UDP packet" aethersdr-20260811-082828.log` → **0**. The TCP session in that same log is healthy throughout; 43 `display pan` status messages arrive normally. Connected radio, dead panadapter.

That is the A/B: same binary, same radio, same tunnel, one variable — whether the prime reaches 4993 — and the VITA-49 stream is present or wholly absent accordingly.

## Evidence 2 — throughput and packet counts

Measured over the same tunnel while I toggled the prime:

| Priming | VITA-49 received |
|---|---|
| `:4992` only (previous client behaviour) | **0** |
| add `:4993` | **3377 in 10 s** |
| then stop priming entirely | **15170** — the flow self-sustains, because inbound traffic refreshes the conntrack entry on its own |

That third row matters for judging the fix: once the return path is open, the stream itself keeps it open. The prime is only needed to establish it and to survive idle periods.

End-to-end with the built app over the same tunnel: tunnel throughput **144 B/s → 370 KB/s**, **2608 packets from `192.168.115.14:4993` in 8 s**, live spectrum trace and running waterfall on 20 m.

## Evidence 3 — packet capture

Captured on `wg0` and attached as a follow-up comment: a normal connect showing the prime egress to both ports and the inbound VITA-49 stream with source port 4993, filtered to the radio's address.

## Ruled out first, each with a measurement

The diagnosis does not rest on the fix working. Each alternative was eliminated before the fix was written:

- **MTU / fragmentation** — zero datagrams at *every* payload size, including a 128-byte 64-bin pan and small audio packets. A path-MTU problem does not drop a 128-byte datagram.
- **NAT / address rewriting** — the radio logs the real tunnel IP: `Client connected from IP 192.168.3.4`. It knows where to send.
- **Bind address** — a wildcard-bound probe saw nothing either, so this is not the client binding the wrong interface.
- **GUI registration** and **low-bandwidth mode** — neither changes the outcome.
- **All four registration mechanisms** — `\x00` to 4992, `udp_register` to 4992, `udp_register` to 4991, `ping` to 4991. None opens the return path on its own.
- **The tunnel itself** — healthy in both directions; UDP DNS resolves across it.

## Why this appears not to have been hit before

SmartSDR has no connect-by-IP: it finds radios by local-LAN discovery broadcast, and anything remote goes over SmartLink. Neither path exercises this case.

- **Discovery broadcast does not cross a routed VPN**, so SmartSDR cannot reach a radio that way in the first place.
- **SmartLink** returns the stream through the Flex relay, so the 4992/4993 asymmetry never bites — which is exactly why SmartLink works 100% of the time for me while the VPN path never did.

AetherSDR's direct-IP connect is what puts a client on the far side of a stateful, routed hop with no relay in between, so it may be the first client to exercise this path at all. That is worth keeping in mind for anything else in the connect sequence that assumes client and radio share a broadcast domain.

## Scope of the evidence — what is *not* established

This is the part relevant to approving a change that touches every user's network path, so stating it directly:

- **One radio, one firmware, one tunnel.** FLEX-6500 on 4.2.20.41343 over WireGuard. Nothing here has been reproduced on a 6400/6600/8600, on another firmware, or over a different VPN implementation.
- **FlexLib does not corroborate the port claims.** Per review of #4926 against `FlexLib_API_v4.1.5.39794`: FlexLib's LAN path binds local **4991** and talks to radio **4991** (`Radio.cs:14439`), registers over TCP with `client udpport` (`Radio.cs:1992-1994`), uses 4992 as the TCP command and discovery port, and **4993 does not appear in FlexLib at all**. This finding is the reviewer's, not independently re-run here. So the port semantics above are a wire observation, not a protocol document.
- **The behaviour appears to have moved.** It started for me around a firmware update to 4.2.18/4.2.20, which is why the proposed fix is deliberately version-agnostic rather than gated on a firmware check — a gate would need revisiting if Flex moves it again.
- **The blast radius of the proposed fix** is one additional unsolicited byte to `radio:4993` per connect, for every user, including the LAN majority who never had this problem and get no benefit. One byte is shorter than any VITA-49 header, so a radio that does not expect it should discard it — but that is *reasoning*, not a measurement, on any model other than the 6500 tested here.

**What would settle it:** a capture from a second model or firmware, showing the VITA-49 source port on a connect. If anyone with a 6400/6600/8600 can run one, that is worth more than any amount of further analysis on this radio.

## Related

- #4926 — the proposed fix (prime both ports; back the routed prime off rather than giving up after 2 s)

**Comment by motoham88** [comment]
## Packet capture, in the configuration @jensenpat asked for

Run exactly as requested: **firewalld disabled on the client**, the released **26.8.2** desktop AppImage (not a dev build), bound to the **wg0 source address**. Captured on `wg0`, filtered to the radio.

This was set up as a test that could have gone against the diagnosis in this issue. It didn't — it removed the most plausible competing explanation.

### Configuration

| | |
|---|---|
| Client | AetherSDR **v26.8.2** release AppImage. #4926 is unmerged, so this build primes **4992 only** — the failing configuration |
| Firewall | `firewalld` **stopped**; `nft` ruleset empty, `iptables -S` all-ACCEPT, no leftover rules |
| Bind | wg0 source `192.168.3.4` |
| Radio | FLEX-6500, fw 4.2.20.41343, `192.168.115.14`, ~37 ms RTT |
| Window | 10:39:09 → 10:42:19 (190 s), 804 frames total |

### Result — every UDP packet in the capture

```
10:39:11.525902 IP 192.168.3.4.46146 > 192.168.115.14.4992: UDP, length 1
10:39:11.788362 IP 192.168.3.4.46146 > 192.168.115.14.4992: UDP, length 1
10:39:12.050769 IP 192.168.3.4.46146 > 192.168.115.14.4992: UDP, length 1
10:39:12.313401 IP 192.168.3.4.46146 > 192.168.115.14.4992: UDP, length 1
10:39:12.574518 IP 192.168.3.4.46146 > 192.168.115.14.4992: UDP, length 1
10:39:12.832878 IP 192.168.3.4.46146 > 192.168.115.14.4992: UDP, length 1
10:39:13.082438 IP 192.168.3.4.46146 > 192.168.115.14.4992: UDP, length 1
10:39:13.332822 IP 192.168.3.4.46146 > 192.168.115.14.4992: UDP, length 1
```

That is the complete list. Eight one-byte primes out to `:4992`, and the conversation table for the whole 190-second window:

```
UDP Conversations
                                              |       <-      | |       ->      |
                                              | Frames  Bytes | | Frames  Bytes |
192.168.3.4:46146 <-> 192.168.115.14:4992          0  0 bytes       8  232 bytes
```

**Zero frames, zero bytes inbound, with no firewall running on this host.**

### Why this matters more than the earlier logs

Every session in the original evidence ran with **firewalld active**. That left a competing explanation I could not rule out and should have flagged sooner: an inbound `radio:4993 → client:ephemeral` flow with no conntrack entry would be dropped by the *client's own* firewall, by exactly the mechanism I was attributing to a stateful hop out on the tunnel. If that were the cause, the correct fix would be different and much smaller in blast radius.

It isn't. With firewalld stopped the result is identical — nothing arrives. **The drop is upstream of the client**, and local firewalling is now eliminated rather than assumed away.

### The TCP side proves the client registered correctly

804 frames of healthy TCP throughout. The registration sequence completed:

```
C4 |client gui <client-guid-redacted>        ->  R4 |0|<handle>     GUI client accepted
C35|client udpport 46146                     ->  R35|0|             UDP PORT ACCEPTED
C56|stream create netcw                      ->  R56|0|0x80800000
C57|stream create type=remote_audio_tx …     ->  R57|0|84000000
C59|stream create type=remote_audio_rx …     ->  R59|0|4000008      audio stream created
```

and a panadapter was open and configured the whole time, so the radio had spectrum to send:

```
display pan 0x40000000 center=7.043050 …
display pan 0x40000000 min_dbm=-125.00 max_dbm=-40.00 rfgain=0 …
C6 |display pan set 0x40000000 xpixels=1590 ypixels=700
```

So: radio accepts the client, accepts its UDP port, creates the streams, has an open pan — and sends nothing to the port it acknowledged. That closes off "the client never registered properly."

### Three incidental confirmations

1. **`client udpport` returns `0`, not `0x50001000`.** `R35|0|` on the wire, on fw 4.2.20. Succeeding does not open the return path — which is the correction #4926 makes to `AGENTS.md`.
2. **The 2-second prime give-up is visible.** Primes run 10:39:11.525 → 10:39:13.332, 1.8 s, then stop forever. That is the fixed window the second commit on #4926 replaces with a backoff.
3. **MTU negotiation happened normally** — `C19|client set enforce_network_mtu=1 network_mtu=1450` — and still nothing arrived. Another independent strike against the MTU theory, on top of the earlier zero-datagrams-at-every-payload-size measurement.

### Artifacts

- **`vita49-udp-firewalld-off.pcap`** — UDP-only, the 8 frames above.
- **`tcp-transcript-redacted.txt`** — the client command sequence with the replies that matter, client GUID redacted.

The UDP capture is 8 frames / 384 bytes, so rather than make anyone download an attachment, here it is inline — decode and open in Wireshark:

```
base64 -d <<'EOF' > vita49-udp-firewalld-off.pcap
1MOyoQIABAAAAAAAAAAAAAAABABlAAAAH0J7ak4GCAAdAAAAHQAAAEUAAB3xPEAAQBFSMMCoAwTA
qHMOtEITgAAJ930AH0J7aooHDAAdAAAAHQAAAEUAAB3xU0AAQBFSGcCoAwTAqHMOtEITgAAJ930A
IEJ7alHGAAAdAAAAHQAAAEUAAB3yLUAAQBFRP8CoAwTAqHMOtEITgAAJ930AIEJ7ajnIBAAdAAAA
HQAAAEUAAB3yTUAAQBFRH8CoAwTAqHMOtEITgAAJ930AIEJ7ajbECAAdAAAAHQAAAEUAAB3zJ0AA
QBFQRcCoAwTAqHMOtEITgAAJ930AIEJ7am61DAAdAAAAHQAAAEUAAB30F0AAQBFPVcCoAwTAqHMO
tEITgAAJ930AIUJ7agZCAQAdAAAAHQAAAEUAAB30VEAAQBFPGMCoAwTAqHMOtEITgAAJ930AIUJ7
ahYUBQAdAAAAHQAAAEUAAB302kAAQBFOksCoAwTAqHMOtEITgAAJ930A
EOF
```

`sha256 = 681a6016a984cdc84f08a7cc1c2d5fbc630a0678658e3c61a65bdd6ec9b20338`

<details>
<summary>tcp-transcript-redacted.txt (click to expand)</summary>

```
# AetherSDR 26.8.2 -> FLEX-6500 (fw 4.2.20.41343) over WireGuard, firewalld disabled
# Client commands, in order. Client GUID redacted. Radio status messages
# omitted (they carry serial / GPS / callsign).

C1|sub radio all
C2|sub client all
C3|client program AetherSDR
C4|client gui <client-guid-redacted>
C5|display pan rfgain_info 0x40000000
C6|display pan set 0x40000000 xpixels=1590 ypixels=700
C7|display pan set 0x40000000 wnb=0
C8|display pan set 0x40000000 wnb_level=50
C9|display pan set 0x40000000 xpixels=1590 ypixels=700
C10|display pan set 0x40000000 xpixels=1590 ypixels=700
C11|display panafall set 0x42000000 auto_black=0 black_level=15 color_gain
C12|slice set 0 active=1
C13|slice set 0 tx=1
C14|transmit set dax=0
C15|display pan set 0x40000000 xpixels=1590 ypixels=700
C16|display pan set 0x40000000 xpixels=1590 ypixels=700
C17|client station tony-laptop
C18|client set send_reduced_bw_dax=1
C19|client set enforce_network_mtu=1 network_mtu=1450
C20|keepalive enable
C21|display pan set 0x40000000 fps=24
C22|display panafall set 0x42000000 line_duration=96
C23|sub slice all
C24|sub pan all
C25|sub tx all
C26|sub atu all
C27|sub amplifier all
C28|sub meter all
C29|sub audio all
C30|sub gps all
C31|sub apd all
C32|sub client all
C33|sub xvtr all
C34|mic list
C35|client udpport 46146
C36|profile global info
C37|profile tx info
C38|profile mic info
C39|sub tnf all
C40|sub memories all
C41|sub cwx all
C42|sub dax all
C43|sub daxiq all
C44|sub radio all
C45|sub codec all
C46|sub dvk all
C47|sub navtex all
C48|sub usb_cable all
C49|sub spot all
C50|sub waveform all
C51|sub license all
C52|display pan set 0x40000000 xpixels=1590 ypixels=700
C53|display pan set 0x40000000 xpixels=1590 ypixels=700
C54|info
C55|slice list
C56|stream create netcw
C57|stream create type=remote_audio_tx compression=opus
C58|radio set mute_local_audio_when_remote=1
C59|stream create type=remote_audio_rx compression=none
C60..C180|ping   (121 keepalive pings — TCP session healthy for the full 190 s window,
                        while zero UDP datagrams arrived)

# Replies that matter:
R4|0|<handle>          <- client gui accepted
R35|0|          <- client udpport 46146 ACCEPTED (returns 0, not 0x50001000)
R56|0|0x80800000   <- stream created
R57|0|84000000   <- stream created
R59|0|4000008   <- stream created
```

</details>

The raw capture is **deliberately not attached**. It carries the radio's full serial number in cleartext from the radio's own status messages — the log redaction that masks it does not apply to the wire. (GPS reports `Not Present` on this radio, so there is no position data in it; callsign is public.) If a maintainer needs something specific from the TCP side, ask and I'll extract that part redacted.

### Still not established

Unchanged by this capture, and worth repeating since it is the real question: **this is still one radio, one firmware, one tunnel.** What this run adds is that the client's own firewall is not the cause, and that the client's registration is not at fault. It does not tell you the VITA-49 source port is 4993 on a 6600 or an 8600. A capture from a second model remains the thing that would settle whether priming both ports belongs on by default for everyone.

**Comment by motoham88** [comment]
[aethersdr-20260811-082828.log](https://github.com/user-attachments/files/30942449/aethersdr-20260811-082828.log)
[aethersdr-20260811-082628.log](https://github.com/user-attachments/files/30942448/aethersdr-20260811-082628.log)
[aethersdr-20260811-073907.log](https://github.com/user-attachments/files/30942447/aethersdr-20260811-073907.log)

[full-sanitized.pcap.txt](https://github.com/user-attachments/files/30942545/full-sanitized.pcap.txt)

**Comment by motoham88** [comment]
Found setting in WireGuard needing checked to allow "New" traffic flows being initiated from the radio side (4993) versus client side return path (4991/4992). This resolves the issue and no code change is needed for AetherSDR. 

Closing issue.
